{
  "version": 1,
  "generatedAt": "2026-08-19T00:47:08.207Z",
  "sourcePolicy": "public-safe home visual manifest only; exposes copied still/turntable assets and approved display copy; excludes raw logs, prompts, remote URLs, model/job IDs, credentials, private IDs, and local source paths",
  "homeComponent": "HomeVisualHero",
  "status": "public_home_allowed",
  "items": [
    {
      "id": "2026-07-22-goyounjung-lantern-guidance-refined",
      "title": "랜턴 안내",
      "dateKst": "2026-07-22",
      "theme": "차가운 안내 / 배경 #4065F8 · 오브젝트 #D4F7EC · 포인트 #B85C4F",
      "metaphor": "단일 랜턴 오브젝트로 표현한 안내와 신뢰",
      "why": [
        "어두운 상황에서 과하게 지시하지 않고 주변을 부드럽게 밝혀주는 안내자의 역할을 나타냅니다.",
        "커넥터/브릿지처럼 유기적으로 보일 수 있는 연결 은유를 제거하고, 단일 오브젝트 중심의 안전한 guidance 메타포로 전환했습니다.",
        "사틴 세라믹 질감, 베벨, 림라이트, 접촉 그림자를 더해 3D 제품 렌더의 완성감을 높였습니다."
      ],
      "imageSrc": "/assets/home-visuals/2026-07-22-01-01-lantern-guidance-refined-1080.png",
      "videoSrc": "/assets/home-visuals/turntables/2026-07-22-01-01-lantern-guidance-turntable.mp4",
      "status": "public_home_allowed",
      "mediaCapability": "turntable_available",
      "detailMedia": "turntable_video",
      "metadata": {
        "dateKst": "2026-07-22",
        "displayMode": "visual_archive_static_still_card_1080",
        "interaction": "dashboard_still_click_opens_turntable_detail_view",
        "promptPolicy": "exact_prompt_hidden_by_default; share only on Chris request",
        "sourceStatus": "final_current",
        "detailFallback": "static_still"
      },
      "publicSafe": true
    },
    {
      "id": "2026-07-22-goyounjung-key-possibility-refined",
      "title": "가능성의 열쇠",
      "dateKst": "2026-07-22",
      "theme": "mint possibility / background #10C19F · object #EFDCEC · accent #B14D92",
      "metaphor": "가능성과 agency를 여는 둥근 키 오브젝트",
      "why": [
        "AI가 사용자의 선택권을 대신 가져가는 것이 아니라, 사용자가 다음 문을 열 수 있게 돕는 도구라는 의미를 담았습니다.",
        "민트 배경과 라일락 오브젝트의 보색 대비로 메타포가 명확히 분리되어 보입니다.",
        "키 헤드의 베벨, 컷아웃 그림자, 은은한 반사광으로 이전보다 더 사실적인 제품 아이콘 느낌을 강화했습니다."
      ],
      "imageSrc": "/assets/home-visuals/2026-07-22-02-02-key-possibility-refined-1080.png",
      "videoSrc": "/assets/home-visuals/turntables/2026-07-22-02-02-key-possibility-turntable.mp4",
      "status": "public_home_allowed",
      "mediaCapability": "turntable_available",
      "detailMedia": "turntable_video",
      "metadata": {
        "dateKst": "2026-07-22",
        "displayMode": "visual_archive_static_still_card_1080",
        "interaction": "dashboard_still_click_opens_turntable_detail_view",
        "promptPolicy": "exact_prompt_hidden_by_default; share only on Chris request",
        "sourceStatus": "final_current",
        "detailFallback": "static_still"
      },
      "publicSafe": true
    },
    {
      "id": "2026-07-22-goyounjung-anchor-stability-refined",
      "title": "앵커 안정감",
      "dateKst": "2026-07-22",
      "theme": "magenta stability / background #B14D92 · object #D4F7EC · accent #156E5C",
      "metaphor": "흔들리지 않는 안정감과 책임감을 나타내는 부드러운 앵커 오브젝트",
      "why": [
        "책임감과 안정성을 무겁고 권위적으로 표현하지 않고, 부드러운 제품 조각처럼 정서적으로 낮췄습니다.",
        "마젠타 배경과 제이드 오브젝트의 강한 분리감으로 단색 배경에서도 메타포가 선명합니다.",
        "베이스 접점의 앰비언트 오클루전과 부드러운 림라이트로 실제 3D 오브젝트 같은 깊이를 더했습니다."
      ],
      "imageSrc": "/assets/home-visuals/2026-07-22-03-03-anchor-stability-refined-1080.png",
      "videoSrc": "/assets/home-visuals/turntables/2026-07-22-03-03-anchor-stability-turntable.mp4",
      "status": "public_home_allowed",
      "mediaCapability": "turntable_available",
      "detailMedia": "turntable_video",
      "metadata": {
        "dateKst": "2026-07-22",
        "displayMode": "visual_archive_static_still_card_1080",
        "interaction": "dashboard_still_click_opens_turntable_detail_view",
        "promptPolicy": "exact_prompt_hidden_by_default; share only on Chris request",
        "sourceStatus": "final_current",
        "detailFallback": "static_still"
      },
      "publicSafe": true
    },
    {
      "id": "2026-07-23-goyounjung-lantern-guidance-no-pebbles",
      "title": "랜턴 안내",
      "dateKst": "2026-07-23",
      "theme": "차가운 안내 / 배경 #4065F8 · 오브젝트 #D4F7EC · 포인트 #B85C4F",
      "metaphor": "조약돌 배열을 제거하고 하나의 매끈한 조명 오브젝트로 표현한 안내와 신뢰",
      "why": [
        "어두운 상황에서 과하게 지시하지 않고 주변을 부드럽게 밝혀주는 안내자의 역할을 나타냅니다.",
        "Chris 피드백을 반영해 조약돌·입자·연결 배열을 제거하고 단일 smooth 오브젝트로 안정감을 높였습니다.",
        "푸른 배경과 민트 오브젝트의 보색 대비, 부드러운 스튜디오 조명으로 One UI식 따뜻한 polish를 유지했습니다."
      ],
      "imageSrc": "/assets/home-visuals/2026-07-23-04-01-lantern-guidance-no-pebbles-1080.png",
      "videoSrc": "/assets/home-visuals/turntables/2026-07-23-04-01-lantern-guidance-no-pebbles-turntable.mp4",
      "status": "public_home_allowed",
      "mediaCapability": "turntable_available",
      "detailMedia": "turntable_video",
      "metadata": {
        "dateKst": "2026-07-23",
        "displayMode": "pinterest_masonry_card",
        "interaction": "dashboard_still_click_opens_turntable_detail_view",
        "promptPolicy": "exact_prompt_hidden_by_default; share only on Chris request",
        "sourceStatus": "final",
        "detailFallback": "static_still"
      },
      "publicSafe": true
    },
    {
      "id": "2026-07-23-goyounjung-moss-planter-no-pebbles",
      "title": "이끼 플랜터",
      "dateKst": "2026-07-23",
      "theme": "민트 생태계 / 배경 #10C19F · 플랜터 #A6E6D4 · 이끼 #156E5C",
      "metaphor": "조약돌 경로 없이 하나의 smooth planter와 연속된 moss cushion으로 표현한 돌봄받는 사용자 맥락",
      "why": [
        "사용자 맥락을 데이터 덩어리가 아니라 돌봄이 필요한 작은 생태계로 보는 이미지입니다.",
        "기존 stepping-stone 구성을 제거해 연결성 과잉이나 반복된 작은 덩어리에서 오는 불편함을 줄였습니다.",
        "민트 배경, 매끈한 세라믹 플랜터, 연속된 moss 쿠션으로 더 단순하고 제품 아이콘다운 형태로 정리했습니다."
      ],
      "imageSrc": "/assets/home-visuals/2026-07-23-05-02-moss-planter-no-pebbles-1080.png",
      "videoSrc": "/assets/home-visuals/turntables/2026-07-23-05-02-moss-planter-no-pebbles-turntable.mp4",
      "status": "public_home_allowed",
      "mediaCapability": "turntable_available",
      "detailMedia": "turntable_video",
      "metadata": {
        "dateKst": "2026-07-23",
        "displayMode": "pinterest_masonry_card",
        "interaction": "dashboard_still_click_opens_turntable_detail_view",
        "promptPolicy": "exact_prompt_hidden_by_default; share only on Chris request",
        "sourceStatus": "final",
        "detailFallback": "static_still"
      },
      "publicSafe": true
    },
    {
      "id": "2026-07-23-goyounjung-velvet-proof-stamp",
      "title": "벨벳 증명 스탬프",
      "dateKst": "2026-07-23",
      "theme": "보라 검증 / 배경 #B14D92 · 오브젝트 #EFDCEC · 포인트 #4C1039",
      "metaphor": "검증된 확신을 부드러운 품질 확인 도구로 바꾸는 velvet proof stamp",
      "why": [
        "브랜드 경험에서 중요한 검증된 확신을 차갑게 통제하는 도장이 아니라 부드러운 품질 확인 도구로 바꿨습니다.",
        "Muyeol식 검증·리스크 감각과 Go Youn-jung식 시각 품질 판단을 함께 담는 상징으로 설계했습니다.",
        "작은 pebble accent는 하나만 유지되어 경로/연결성 과잉이 아니라 정제된 proof cue로 읽히게 했습니다."
      ],
      "imageSrc": "/assets/home-visuals/2026-07-23-06-03-velvet-proof-stamp-1080.png",
      "videoSrc": "/assets/home-visuals/turntables/2026-07-23-06-03-velvet-proof-stamp-turntable.mp4",
      "status": "public_home_allowed",
      "mediaCapability": "turntable_available",
      "detailMedia": "turntable_video",
      "metadata": {
        "dateKst": "2026-07-23",
        "displayMode": "pinterest_masonry_card",
        "interaction": "dashboard_still_click_opens_turntable_detail_view",
        "promptPolicy": "exact_prompt_hidden_by_default; share only on Chris request",
        "sourceStatus": "final",
        "detailFallback": "static_still"
      },
      "publicSafe": true
    },
    {
      "id": "2026-07-24-goyounjung-gyroscope-trust-cradle",
      "title": "자이로스코프 신뢰 크래들",
      "dateKst": "2026-07-24",
      "theme": "균형 잡힌 안내 / 배경 #4065F8 · 오브젝트 #D4F7EC · 포인트 #B85C4F",
      "metaphor": "마디 없는 하나의 매끈한 gyroscope cradle로 표현한 균형 잡힌 책임과 신뢰 가능한 안내",
      "why": [
        "기존 1번의 마디·벌레 같은 인상을 제거하기 위해 조명/마디 구조를 완전히 버리고 gyroscope 계열로 전환했습니다.",
        "하나의 연속된 링과 중심 구체가 과도하게 지시하지 않는 안정적 안내와 균형 잡힌 책임을 나타냅니다.",
        "단색 파란 배경과 민트 세라믹 오브젝트, 작은 terracotta accent로 따뜻하지만 정제된 One UI식 polish를 유지합니다."
      ],
      "imageSrc": "/assets/home-visuals/2026-07-24-07-01-gyroscope-trust-cradle-1080.png",
      "videoSrc": "/assets/home-visuals/turntables/2026-07-24-07-01-gyroscope-trust-cradle-turntable.mp4",
      "status": "public_home_allowed",
      "mediaCapability": "turntable_available",
      "detailMedia": "turntable_video",
      "metadata": {
        "dateKst": "2026-07-24",
        "displayMode": "pinterest_masonry_card",
        "interaction": "dashboard_still_click_opens_turntable_detail_view",
        "promptPolicy": "exact_prompt_hidden_by_default; share only on Chris request",
        "sourceStatus": "final",
        "detailFallback": "static_still"
      },
      "publicSafe": true
    },
    {
      "id": "2026-07-24-goyounjung-02-listening-pod",
      "title": "리스닝 포드",
      "dateKst": "2026-07-24",
      "theme": "차가운 파랑 / #4065F8·#A1D0F6·#001C33",
      "metaphor": "사용자 맥락을 조용히 받아들이는 매끈한 리서치 포드",
      "why": [
        "사용자 리서치를 “소리를 크게 모으는 장치”가 아니라 맥락을 조용히 받아들이는 포드로 표현했습니다.",
        "구멍·그릴·입자 없이 매끈한 단일 오브젝트로 만들어, 어제 피드백의 징그러운 반복 요소를 피했습니다."
      ],
      "imageSrc": "/assets/home-visuals/2026-07-24-08-02-listening-pod-1080.png",
      "videoSrc": "/assets/home-visuals/turntables/2026-07-24-08-02-listening-pod-turntable.mp4",
      "status": "public_home_allowed",
      "mediaCapability": "turntable_available",
      "detailMedia": "turntable_video",
      "metadata": {
        "dateKst": "2026-07-24",
        "displayMode": "pinterest_masonry_card",
        "interaction": "dashboard_still_click_opens_turntable_detail_view",
        "promptPolicy": "exact_prompt_hidden_by_default; share only on Chris request",
        "sourceStatus": "final",
        "detailFallback": "static_still"
      },
      "publicSafe": true
    },
    {
      "id": "2026-07-24-goyounjung-03-memory-capsule-safe",
      "title": "메모리 캡슐 금고",